{
  "$schema": "https://json-schema.org/draft/2020-12/schema",
  "$id": "https://grga.dev/schemas/trace-viz-session-v1.json",
  "title": "grga trace-viz session v1",
  "description": "Data format for a retrospective visualization of a single grga (or similar multi-step retrieval + reflection) search session. Consumed by tools/trace-viz/build_html.py to produce a swim-lane HTML. See tools/trace-viz/README.md.",
  "type": "object",
  "required": ["session_version", "steps", "family_order", "family_colors", "kind_markers", "kind_labels"],
  "properties": {
    "session_version": {
      "type": "string",
      "const": "1.0",
      "description": "Schema contract version. Bump MAJOR on breaking changes."
    },
    "title": {
      "type": "string",
      "description": "Optional session title shown in the HTML sidebar header."
    },
    "subtitle": {
      "type": "string",
      "description": "Optional short caption under the title (e.g. 'N steps · M families · corpus')."
    },
    "steps": {
      "type": "array",
      "minItems": 1,
      "description": "One entry per search step in chronological order.",
      "items": { "$ref": "#/$defs/step" }
    },
    "family_order": {
      "type": "array",
      "minItems": 1,
      "description": "Column order (left to right) for the family lanes.",
      "items": { "type": "string" }
    },
    "family_colors": {
      "type": "object",
      "description": "family_name -> hex color string. Every family in family_order MUST have a color.",
      "additionalProperties": {
        "type": "string",
        "pattern": "^#[0-9a-fA-F]{6}$"
      }
    },
    "kind_markers": {
      "type": "object",
      "description": "kind -> single-char marker glyph used inside the node circle.",
      "additionalProperties": { "type": "string" }
    },
    "kind_labels": {
      "type": "object",
      "description": "kind -> human-readable label used in legend and tooltip.",
      "additionalProperties": { "type": "string" }
    },
    "summary": {
      "type": "object",
      "description": "Optional pre-rendered content for the sidebar 'summary' section (stats + path features). When present, build_html injects these strings verbatim into the sidebar template.",
      "properties": {
        "stats_html":         { "type": "string" },
        "path_features_html": { "type": "string" }
      },
      "additionalProperties": false
    }
  },
  "$defs": {
    "step": {
      "type": "object",
      "required": ["step", "family", "kind", "cmd", "decision"],
      "additionalProperties": false,
      "properties": {
        "step": {
          "type": "integer",
          "minimum": 1,
          "description": "1-based step index. Must be unique and sequential across the session."
        },
        "family": {
          "type": "string",
          "description": "Which query-keyword family this step belongs to. MUST appear in family_order."
        },
        "kind": {
          "enum": ["prep", "probe", "search", "expand", "related", "suggest", "antipattern", "synthesize"],
          "description": "Step kind. 'antipattern' auto-triggers black outline; 'synthesize' auto-triggers larger radius."
        },
        "cmd": {
          "type": "string",
          "description": "Short command snippet shown as <code> in tooltip. Drop -d path and other noise; keep verb + query."
        },
        "signal": {
          "type": ["string", "integer", "null"],
          "description": "Visible hit signal shown next to the node (e.g. '7 hits', 46, 'empty'). Prefix with '🎯 ' to trigger gold-highlight for a jackpot hit."
        },
        "decision": {
          "type": "string",
          "description": "What the caller decided after this step. Shown in tooltip 'decision' row."
        },
        "insight": {
          "type": "string",
          "description": "Optional lesson / observation. Shown in tooltip 'insight' row. Empty string is fine."
        }
      }
    }
  }
}
